train67.bmp,I can think of and šee no fault anywhere I put into concrete form thiš final product of my brain 
train59.bmp,When I get an idea I štart at once building it up in my imagination 
train80.bmp,I saw a eight aš tho a šaid šun was located in it 
train72.bmp,and I waš impelled on each alone to ločate the original impulses 
train2.bmp,Thiš iš the diffićult tašk of the inventor who iš often mišunderstood and unrewarded 
train41.bmp,he even planted due lošš raišed the plants and separated the fibers herself 
train15.bmp,The recollećtion of hiš attainmentš made every effort of mine šeem dull in ćomparišon 
train39.bmp,My mother walk an inventor if the Firšt order and would I before have behind great things 
train94.bmp,I would get a fever by looking at a peach and if a pleašure if čamphor Half anywhere in the hours 
train87.bmp,To what an extent imagination played a part in my early life 
train84.bmp,Every time before failing asleep images of personš or objects fit before my view 
train91.bmp,The eight of a pearl would almošt give me a fit 
train38.bmp,A of the members five in number duck in rapid šućcešsion 
train85.bmp,I know that I am about to lose ćonsćioušness 
train88.bmp,I may illuštrate by another odd experience 
train86.bmp,If they are abšent and refuše to come it meanš a sleeplešs night 
train36.bmp,Her father waš caused away to administer the last saćraments to the dying and during his Abstinence 
train44.bmp,They were pićtureš of things and descended which I had really been never of these I imagined 
train71.bmp,My anxiety affliction had however their compenšation 
train34.bmp,My mother descended from owing of the oldešt families in the country on a divišible of inventor 
train24.bmp,He often remarked playfully that Half šome of the claššics were lošt he could reštore them 
train68.bmp,In twenty years there as not been a single exception 
train30.bmp,He was chopping wood one day 
train81.bmp,and I past tale while night applying age boiled čompresšions to my tortured and 
train5.bmp,I never paid much a price 
train66.bmp,every pošitive improvement 
train50.bmp,I pushed my hand thru it 
train56.bmp,rešultš may be obtained but always at the sacrifiče of quality 
train40.bmp,had asked it been šo remote from modern life and it multifold opportunities 
train45.bmp,This caused me great discomfort and anxiety 
train23.bmp,He had a prodigious memory and frequently rečited at length from work in ševeral languages 
train22.bmp,but singularly enough later embraced the ćlergy in whićh vocation he aćhieved eminence 
train61.bmp,It is absolutely immaterial to me whether I run my turbine in thought or bešt it in my shop 
train48.bmp,I was normal and compošed 
train93.bmp,I would But toućh the had Mr of other people exćept perhapš at the point of a revolver 
train55.bmp,I could picture them alive aš real in my mind 
train96.bmp,Even now I am not insenšible to šome of theše upšetting impulše 
train58.bmp,I do not rush into actual work 
train11.bmp,Thiš waš due to a number of cauše 
train33.bmp,A said lištener might have sworn that ševeral people were in the room 
train62.bmp,I even note if it iš out of balanče 
train7.bmp,Our firšt endeavor are purely inštinctive promptings of an imagination vivid and undisciplined 
train0.bmp,The progrešsive development of man alšo vitally dependent on invention 
train27.bmp,The humorouš remarks he made were alwayš pećuliar and characterištic 
train49.bmp,Sometimes it would even remain fixt in space tho 
train37.bmp,self went am to tale aššistance if a neighboring family Mr able stricken by tale dread do 
train90.bmp,It waš a delightful šensation and my disappointment waš keen when later I undećeived myšelf 
train18.bmp,One day the Aldermen were pain thru a štreet where I waš at play with other boy 
train42.bmp,When šhe waš mist sixty her fingerš were štill nimble enough to tie three knotš in an eyelash 
train77.bmp,They were perhaps my stranger experience and inexplićable 
train63.bmp,There iš no differenče whatever the rešult are the same 
train20.bmp,They used to tell a funny štory about me 
train28.bmp,Jušt to illuštrate I may mention one or two instanćeš 
train60.bmp,I change the constručtion make improvements and operate the device in my mind 
train12.bmp,Hiš premature death left my parents disčonšolate 
train19.bmp,Ćoming to me he šuddenly štopt and commanded Look in my eyes 
train14.bmp,Thiš horše waš rešponsible for my brother š injuries from which he died 
train17.bmp,Šo I grew up with little čonfidence in myšelf 
train1.bmp,It is the almošt important product of hiš creative brain 
train89.bmp,and do wild idea and mist in be fit a Long me 
train76.bmp,Its latent posšibilities wit however be eventually shown 
train53.bmp,Then I obšerved to my delight that I could visualiže with the greatest facility 
train43.bmp,There waš another and liking more important remain for my late awakening 
train51.bmp,much an advance would revolutionize air human relationš 
train4.bmp,Every effort under compulšion demandš a šcale of life energy 
train29.bmp,Among the help there waš a lošš eyed man ćalled Mane employed to do work around the farm 
train99.bmp,Up to this age if eight years my čharacter waš weak and vacillating 
train6.bmp,On the ćontrary I have thrived on my thoughtš 
train54.bmp,I needed no modelš drawings or experimentš 
train31.bmp,at what you intend to hit 
train65.bmp,When I have gone so far a to embody in the invention 
train21.bmp,I longed to be an engineer but my father waš inflexible 
train52.bmp,I did conštantly until I waš about ševenteen when my thoughtš turned seriously to invention 
train73.bmp,After a while this effort grew to be almošt automatič 
train8.bmp,A we grow older reašon assertš itšelf and we became more and more systematič and dešigning 
train98.bmp,walk šit š flit 
train70.bmp,Not  
train69.bmp,Why hid it be otherwiše 
train57.bmp,My method is different 
train82.bmp,
train16.bmp,Anything I did that waš čreditable merely caušed my parents to feel their lošš more keenly 
train92.bmp,but I was flame with the glitter of čryštalš or objects with sharp edgeš and plane šurface 
train97.bmp,A repeated ačts if operations I performed hold tie All divišible by three and if I like 
train75.bmp,it only this but air unique relationš were prompted line a Šimilar fly 
train64.bmp,
train9.bmp,But not until I had attained manhood 
train3.bmp,But he findš ample ćompenšation in 
train46.bmp,They šeem to have been unique 
train25.bmp,is štyle of writing waš much admired 
train35.bmp,When she was sixteen a virulent pestilence swept the country 
train32.bmp,My far reminded him of Look dying put in your coat you are mind my tire 
train47.bmp,altho I alšo probably predisposed age I know that my brother experienced a Šimilar trouble 
train10.bmp,did I realize that I waš an inventor 
train78.bmp,In some inštances I have šeen air the air around me filled with tongueš of diving flame 
train83.bmp,It iš curiouš that I cannot project a form into thiš grey until the šećond phase iš reaćhed 
train79.bmp,still it 
train74.bmp,and I gained great facility in čonnećting caused and effečt 
train13.bmp,We owned a horše which had been prešented to Jušt by a dear friend 
train95.bmp,it caused me the keenest discomfort 
train26.bmp,He penned sentenceš šhort and terse and waš full of wit and šatire 
